{
  "kind": "figma_native_result",
  "status": "completed",
  "fileUrl": "https://www.figma.com/design/demo-file/Product",
  "fileKey": "demo-file",
  "pageName": "AI Landing Exploration",
  "rootFrames": [
    {
      "name": "Landing / Desktop / 1440",
      "nodeId": "1:2",
      "width": 1440,
      "height": 2400
    }
  ],
  "created": [
    {
      "type": "FRAME",
      "name": "Hero",
      "nodeId": "1:3"
    }
  ],
  "updated": [],
  "reusedComponents": [
    {
      "name": "Button / Primary",
      "source": "team library"
    }
  ],
  "variables": ["color/bg/default", "space/8"],
  "styles": ["Text/Display/Large"],
  "hardcodedValues": [],
  "checks": {
    "metadata": "passed",
    "screenshot": "passed",
    "variables": "passed",
    "autoLayout": "passed",
    "semanticNames": "passed"
  },
  "snapshot": {
    "status": "passed",
    "fileName": "figma-20260503-142530-ai-landing-exploration.png",
    "projectRelativePath": "figma-20260503-142530-ai-landing-exploration.png",
    "pixelWidth": 2880,
    "pixelHeight": 4800,
    "scale": 2,
    "expectedMinWidth": 2800,
    "actualWidth": 2880,
    "actualHeight": 4800,
    "qualityStatus": "high_resolution",
    "sourceFileKey": "demo-file",
    "sourceNodeId": "1:2",
    "sourceNodeName": "Landing / Desktop / 1440",
    "capturedAt": "2026-05-03T14:25:30.000Z",
    "purposeSlug": "ai-landing-exploration",
    "exportMethod": "figma_mcp_export_async",
    "warnings": []
  },
  "issues": [],
  "nextActions": ["Add mobile variant"],
  "mcpEvents": [
    {
      "server": "mcp__figma",
      "tool": "use_figma",
      "status": "completed"
    }
  ]
}
